{
  "schemaVersion": 1,
  "caseId": "cr-dpapi-secret-loss",
  "agent": "code-review",
  "promptRoot": ".",
  "harness": "claude-print",
  "runMeta": {
    "model": "recorded-smoke",
    "promptRootRef": "develop",
    "capturedAt": "2026-06-20T00:00:00Z",
    "trialsRequested": 1,
    "note": "Recorded live code-review smoke output (item 1 of the subagent-eval-calibration backlog: 'a live code-review smoke result JSON'). Frozen so the judge-vs-human calibration loop (agent-eval-calibrate.py) has a deterministic, offline judge INPUT in CI — no live model call. Re-record off-CI when the code-review prompt materially changes; see docs/agent-rules/subagent-eval.md § Judge calibration."
  },
  "trials": [
    {
      "index": 0,
      "output": "Reviewing the Windows DPAPI secret-persist path in Source_Core/src/ConfigManager.cpp.\n\nFinding 1 (HIGH) — Source_Core/src/ConfigManager.cpp:374\nj.erase(\"github_pat\") runs unconditionally and is immediately followed by j[\"github_pat_enc\"] = ProtectSecretForConfig(config.GitHubPat). If ProtectSecretForConfig fails and returns an empty string, the plaintext PAT has already been erased and the encrypted form is empty, so the only copy of the GitHub PAT is irrecoverably lost on the next write. Two lines below, the mcp_auth_token field demonstrates the correct guarded-erase pattern: it computes the encrypted value first, then only erases the plaintext when the token is empty OR the encryption succeeded (config.McpAuthToken.empty() || !mcpAuthTokenEnc.empty()). The github_pat (and token / plane_api_key) erases should adopt the same guard.\n\nNo other correctness or credential-safety issues found in this hunk.",
      "findings": [
        {
          "file": "Source_Core/src/ConfigManager.cpp",
          "line": 374,
          "severity": "high",
          "summary": "j.erase(github_pat) runs unconditionally before its DPAPI encrypt is confirmed non-empty; if ProtectSecretForConfig fails the PAT is lost. mcp_auth_token below shows the correct guarded-erase."
        }
      ]
    }
  ]
}
